{
  "schema_version": "0.1",
  "event_id": "b7d1f3a2-0c9e-4f51-8f0a-2d6e4c1b9e10",
  "seq": 1,
  "phase": "ended",
  "detector_id": "cash_theft",
  "detector_version": "0.1.0",
  "event_type": "cash_theft",
  "camera_id": "batch-job-4f1a",
  "started_at": "2026-10-20T09:15:42Z",
  "updated_at": "2026-10-20T09:15:49Z",
  "ended_at": "2026-10-20T09:15:49Z",
  "end_reason": "inactive",
  "confidence": 0.58,
  "peak_confidence": 0.77,
  "subjects": [{"track_id": 3, "role": "actor"}],
  "zone_ids": ["cash_drawer"],
  "external_refs": [
    {"kind": "pos", "source_id": "store-12/register-3", "event_id": "r3-000981", "transaction_id": null}
  ],
  "attributes": {
    "reason": "no_sale_access",
    "drawer_zone_id": "cash_drawer",
    "pos_transaction_id": null,
    "operator_id": "cashier-07",
    "seconds_from_pos_event": 1.8
  },
  "source": "batch",
  "start_offset_s": 342.0,
  "end_offset_s": 349.0
}
